"question","answer"
"What kind of economy car do you have?","Economy cars are Mitsubishi Mirage and Nissan Versa."
"What kind of luxury car do you have?","Luxury cars are Chevy Tahoe and Dodge Charger."
"Which car is luxury and which one is economy?","Economy cars are Mitsubishi Mirage and Nissan Versa. Luxury cars are Chevy Tahoe and Dodge Charger"
"What kind of cars do you have?","Economy cars are Mitsubishi Mirage and Nissan Versa. Luxury cars are Chevy Tahoe and Dodge Charger"
"What number can I call to get info?","+1 123 345 6789"